------,------
Lorem Ipsum is simply dummy text of the printing and typesetting industry.,로렘 입숨은 인쇄와 조판 산업의 단순한 가짜 텍스트이다.
"Lorem has been the industry's standard dummy text ever since the 1500s,",로렘은 1500년대부터 업계의 표준 더미 텍스트였다.
when an unknown printer took a galley of type and scrambled it to make a type specimen book.,무명의 프린터가 활자로 된 갤리선을 가지고 그것을 스크램블해서 활자 견본 책을 만들었을 때.
"It has survived not only five centuries, but also the leap into electronic typesetting,",그것은 5세기 동안 생존했을 뿐만 아니라 전자 조판으로 도약하기도 했다.
remaining essentially unchanged. It was popularised in the 1960s with the release of Letraset sheets containing Lore,본질적으로 변하지 않은 채로 있다. 1960년대에 로레가 포함된 레트라세트 시트가 출시되면서 대중화되었다.
and more recently with desktop publishing software like Aldus PageMaker including versions of Lorem Ipsum.,그리고 최근에는 로렘 입섬 버전을 포함한 Aldus PageMaker와 같은 데스크톱 출판 소프트웨어를 사용했습니다.
